{
  "$schema": "../schemas/action-definition.schema.json",
  "id": "action:look",
  "commandVerb": "look",
  "name": "Look (at Location)",
  "target_domain": "none",
  "prerequisites": [],
  "template": "look",
  "dispatch_event": {
    "eventName": "event:look_intended",
    "payload": {
      "actorId": "actor.id",
      "scope": "literal.string.location",
      "targetEntityId": "literal.null"
    }
  }
}