{
  "$schema": "../schemas/action-definition.schema.json",
  "id": "core:unlock",
  "commandVerb": "unlock",
  "name": "Unlock",
  "target_domain": "environment",
  "actor_required_components": [],
  "actor_forbidden_components": [],
  "target_required_components": [
    "Lockable"
  ],
  "target_forbidden_components": [],
  "prerequisites": [],
  "template": "unlock {target}"
}